work_id,title,rating,category,fandom,relationship,character,additional tags,language,published,status,status date,words,chapters,comments,kudos,bookmarks,hits18390647,Twilight Hour,Teen And Up Audiences,F/M,"Twilight Series - Stephenie Meyer, Twilight Series - All Media Types, Twilight (Movies)","Alice Cullen/Jasper Hale, Edward Cullen/Bella Swan, Emmett Cullen/Rosalie Hale, Carlisle Cullen/Esme Cullen","Alice Cullen, Jasper Hale, Edward Cullen, Bella Swan, Emmett Cullen, Rosalie Hale, Carlisle Cullen, Esme Cullen, Renesmee Cullen","Angst, Mystery, Discovery",English,2019-04-08,Updated,2020-08-24,51494,41/?,10,32,12,1080
26092381,wilt,General Audiences,Gen,Twilight Series - All Media Types,Jessica Stanley & Bella Swan,"Jessica Stanley, Bella Swan",human centric twilight fic,English,2020-08-24,Completed,2020-08-24,512,1/1,2,10,2,42
26091832,That One Time in College,General Audiences,Gen,"Twilight Series - Stephenie Meyer, Twilight Series - All Media Types","Edward Cullen/Bella Swan, Alice Cullen/Jasper Hale, Carlisle Cullen/Esme Cullen, Emmett Cullen/Rosalie Hale","Bella Swan, Carlisle Cullen, Edward Cullen, Esme Cullen, Alice Cullen, Jasper Hale, Rosalie Hale, Emmett Cullen","Post-Breaking Dawn, Vampire Bella Swan, No Renesmee Cullen, we all know she was a mistake, shitpost, I Don't Even Know, How Do I Tag, Carlisle Cullen acting his age, Funny",English,2020-08-24,Updated,2020-08-24,1311,1/?,2,13,5,246
20341924,Daybreak,Explicit,F/M,Twilight Series - All Media Types,"Carlisle Cullen & Original Female Character(s), Carlisle Cullen/Original Character(s), Alice Cullen/Jasper Hale, Emmett Cullen/Rosalie Hale, Carlisle cullen/oc","Carlisle Cullen, Edward Cullen, Bella Swan, Emmett Cullen, Rosalie Hale, Jasper Hale, Alice Cullen","Anxiety, Depression, Rape/Non-con Elements, Romance, Vampires, Eventual Sex, Eventual Smut, First Time, Mental Health Issues, relationships",English,2019-08-21,Updated,2020-08-24,12690,5/?,7,43,4,733
26087788,Why me?,Mature,"F/M, Multi","Twilight Series - Stephenie Meyer, Twilight (Movies), Twilight Series - All Media Types","Carlisle Cullen/Reader, Carlisle/female!reader, Carlisle/human!reader, Carlisle/pregnant!reader, Jasper/Alice, Edward/Bella, Emmett/Rosalie, Carlisle/OC","Carlisle Cullen, Edward Cullen, Jacob Black, Bella Swan, Charlie Swan, Jasper Hale, Alice Cullen, Rosalie Hale, Emmett Cullen",,English,2020-08-24,Completed,2020-08-24,1167,1/1,null,12,1,255
24884794,Twilight: Blood Moon,Mature,"F/F, F/M","Twilight Series - Stephenie Meyer, Twilight Series - All Media Types, Twilight (Movies)","Edward Cullen/Bella Swan, Alice Cullen/Jasper Hale, Carlisle Cullen/Esme Cullen, Rosalie Hale/Original Female Character(s), Leah Clearwater/Original Female Character(s), Emmett Cullen/Irina Denali, James/Laurent/Victoria, Sam Uley/Emily Young, Jacob Black/Bella Swan","Carlisle Cullen, Edward Cullen, Emmett Cullen, Esme Cullen, Rosalie Hale, Alice Cullen, Jasper Hale, Bella Swan, Laurent (Twilight), James (Twilight), Victoria (Twilight), Original Female Character, Tyler Crowley, Mike Newton, Jessica Stanley, Eric Yorkie, Angela Weber, Leah Clearwater, Jacob Black, Sam Uley, Irina Denali","Twilight References, Twilight Alternate Relationships, Canon Lesbian Relationship, Lesbian Characters, Lesbian Vampires, Rosalie Hale Main Character, Newborn Vampires, Forks High School (Twilight), Forks [Washington], Twilight Universe, Vampires vs Werewolves, Team Cullen, Past Life History, New Cullen Character, Friendship/Relationship - Freeform",English,2020-07-21,Updated,2020-08-24,29680,10/?,23,114,27,1681
26083777,Hyperion,General Audiences,"F/M, Gen","Twilight Series - Stephenie Meyer, Twilight Series - All Media Types",Quil Ateara V/Leah Clearwater,"Leah Clearwater, Quil Ateara V, Quileute Tribe, Quileute Shifters (Twilight)","Pack Dynamics, Alternate Universe, Alternate Universe - Canon Divergence, quil ateara v & claire young - Freeform, platonic quil/claire only, Imprinting, Imprinting (Twilight), Anti-Imprinting, Friends to Lovers, Shapeshifting, POV Third Person, 5 Things, dont tell my wip i'm here",English,2020-08-24,Completed,2020-08-24,3333,1/1,1,19,2,158
22679197,Complicated,Explicit,F/F,Twilight Series - Stephenie Meyer,Leah Clearwater/Bella Swan,"Bella Swan, Leah Clearwater","Romance, Drama, Comedy",English,2020-02-12,Updated,2020-08-24,77244,24/?,23,256,65,6628
21574606,I Need Some Vampire Boss Booty!,Mature,"F/M, Gen",Twilight Series - All Media Types,"Jasper Hale/Original Female Character(s), Aro (Twilight)/Original Female Character(s), Jane (Twilight)/Original Character(s), Emmett Cullen/Rosalie Hale, Alice Cullen/Edward Cullen, Other Relationship Tags to Be Added","Bella Swan, Emmett Cullen, Edward Cullen, Original Characters, Alice Cullen, Rosalie Hale, Jasper Hale, Aro (Twilight), Caius (Twilight), Marcus (Twilight), Jane (Twilight), Felix (Twilight), Embry Call, Seth Clearwater, Leah Clearwater, Jacob Black, Twilight Series Characters","Romance, Self Insert, Bella Swan Bashing, just a little bit, slow updates (ish), Alternate Universe - Canon Divergence, More tags to be added, some characters cease to exist, Asexual Character, Bisexual Character, Pansexual Character, Heterosexual Character",English,2019-11-26,Updated,2020-08-24,5666,4/?,6,52,12,1175
26076589,Affection,Explicit,F/M,Twilight Series - Stephenie Meyer,Carlisle Cullen/Bella Swan,"Carlisle Cullen, Bella Swan, Edward Cullen","Light Spanking, Fingering, bella is 18, Foreplay, Mutual Masturbation, Running Away, Fluff and Smut, PWP, Domestic Fluff, No Beta",English,2020-08-24,Completed,2020-08-24,1953,1/1,1,12,4,1018
26074084,Mrs. Dr. Acula,Teen And Up Audiences,F/M,Twilight,"Carlisle Cullen/Reader, Carlisle Cullen/Original Female Character(s)","Carlisle Cullen, Emmett Cullen, Rosalie Hale, Edward Cullen, Alice Cullen, Jasper Hale, Esme Cullen, Original Female Character(s)",Marriage Proposal,English,2020-08-23,Completed,2020-08-23,2098,1/1,null,18,null,277
26071009,Sundown,Teen And Up Audiences,M/M,Twilight Series - All Media Types,"Edward Cullen/Beau Swan, Jacob Black/Beau Swan","Beau Swan, Edward Cullen, Jacob Black, Carlisle Cullen, Esme Cullen, Emmett Cullen, Rosalie Hale, Alice Cullen, Jasper Hale, Charlie Swan, Mike Newton, Jessica Stanley, Angela Weber, Eric Yorkie, Tyler Crowley, Billy Black, Leah Clearwater, Sam Uley, James (Twilight), Victoria (Twilight), Laurent (Twilight), Original Characters","Renee Dwyer - Mentioned, Canon Divergence, Children of The Moon, Vampires vs Werewolves",English,2020-08-23,Updated,2020-08-23,4626,1/?,8,11,2,102
20493488,Twlwight,Teen And Up Audiences,"F/F, M/M","Twilight Series - Stephenie Meyer, Twilight Series - All Media Types, Twilight (Movies)","Alice Cullen/Bella Swan, Other Relationship Tags to Be Added, Carlisle Cullen/Charlie Swan, Carlisle Cullen & Esme Cullen, trust me i have a plan to sort this ok","Bella Swan, Edward Cullen, Charlie Swan, Alice Cullen, Mike Newton, Eric Yorkie, Jessica Stanley, Carlisle Cullen, Jasper Hale, Rosalie Hale, Emmett Cullen, Angela Weber, Jacob Black, Esme Cullen","everyone is gay now, all your faves are gay, even the dads, Crack Treated Seriously, Alternate Universe, Canon Rewrite, Lesbian Bella Swan, Everyone is also nicer now, Mike is ADHD, this is starting to get away from me, Trans Jacob Black, which... isnt much of a tag apparently, oh god how am i supposed to tag this, Humor, Everyone Is Gay, Gay Edward Cullen, wlw/mlm solidarity, also wlw/mlm hostility but, they get over it lmao",English,2019-09-02,Updated,2020-08-23,45465,6/?,144,286,70,4803
26064868,Backseat,Mature,F/M,Twilight Series - All Media Types,Jasper Hale/You,"Jasper Hale, Reader","Top Jasper Hale, Major Jasper Whitlock, Smut, Choking, Spanking, Twilight References",English,2020-08-23,Completed,2020-08-23,998,1/1,null,32,null,780
25421353,Eyes For You,Teen And Up Audiences,F/M,"Twilight Series - All Media Types, Twilight (Movies), Twilight Series - Stephenie Meyer","Paul Lahote/Original Female Character(s), Paul Lahote/Original Character(s)","Paul Lahote, Original Characters","Korean Characters, Imprinting, wolfpack",English,2020-07-21,Updated,2020-08-23,10221,7/?,1,16,4,444
25869889,"take a look at me now, oh there's just an empty space",Mature,F/M,Twilight Series - Stephenie Meyer,Edward Cullen/Bella Swan,"Edward Cullen, Bella Swan","Death, Angst, no happy ending, Sad, bella dies, Mild Gore",English,2020-08-23,Completed,2020-08-23,601,1/1,null,14,1,219
25435267,Full Moon,Mature,"F/M, Gen",Twilight Series - All Media Types,"Carlisle Cullen/Bella Swan, Leah Clearwater & Bella Swan","Bella Swan, Carlisle Cullen, Cullen Family, Olympic Coven, Denali Coven (Twilight), Jacob Black, Leah Clearwater, Angela Weber, Charlie Swan, Victoria (Twilight), Laurent (Twilight), Lauren Mallory, Tyler","Coven Dynamics, Developing Relationship, Secret Relationship, Relationship Negotiation, Justice For Rosalie, Justice For Leah, Shapeshifting, Wolf Pack, Alternate Universe - Canon Divergence, Canon Rewrite, BAMF Bella Swan, Bella reacts like a normal person to people sneaking into her windows, Soul Bond, no beta we die like men, Older Man/Younger Woman, Age Difference, Charlie finds out, The Birthday Party is much more horrific than was planned, Oops, themes of fate, Non-Explicit Sex, in late chapters, Charlie is a Good Dad, Renee is a bad mom, Loss of Virginity, Lauren Mallory is a bomb bitch, Lauren Mallory is also a mess, I just realized Bella is a mess too, Hindsight is 20-20, Maybe the real therapy is the children we adopted along the way, Jacob is an idiot, Sam is a tired dad, Canon-Typical Violence, Vampire Turning",English,2020-07-22,Completed,2020-08-23,178967,31/31,827,382,62,9933
25964053,i want to kiss like my heart is hitting the ground,Teen And Up Audiences,F/M,"Twilight Series - Stephenie Meyer, Twilight Series - All Media Types","Edward Cullen/Bella Swan, Alice Cullen/Jasper Hale, Emmett Cullen/Rosalie Hale, Carlisle Cullen/Esme Cullen","Edward Cullen, Bella Swan, Jasper Hale, Alice Cullen, Emmett Cullen, Rosalie Hale, Carlisle Cullen, Esme Cullen","Established Relationship, Kissing, smut in second chapter, this takes place sometime in between twilight and new moon, this is literally just bella being horny, she wants that vampire dick, can u blame her, i don't own twilight or its characters, yes i'm writing twilight fanfiction in 2020 what about it, i stole the title from a mitski song bc i couldn't think of anything else lmao, I Love Alice, who doesn't honestly, author is addicted to commas, Blink And You Miss It D/s, Hints of praise kink",English,2020-08-23,Completed,2020-08-23,3716,2/2,6,53,7,639
26062231,Bitter,General Audiences,Gen,Twilight Series - Stephenie Meyer,Leah Clearwater/Original Male Character(s),Leah Clearwater,,English,2020-08-23,Completed,2020-08-23,995,1/1,1,7,null,121
26061733,Aro's Darling,Not Rated,F/M,Twilight Series - Stephenie Meyer,Aro (Twilight)/Original Female Character(s),"Aro (Twilight), Caius (Twilight), Marcus (Twilight)",,English,2020-08-23,Completed,2020-08-23,6222,4/4,null,1,null,373
24689476,Last Resort,Explicit,F/M,"Twilight Series - Stephenie Meyer, Twilight Series - All Media Types",Bella Swan/Charlie Swan,"Bella Swan, Charlie Swan","Rape/Non-con Elements, Non-Consensual Touching, Father-Daughter Relationship, Parent/Child Incest, References to Depression, Mental Health Issues, Mental Coercion, Non-Consensual Somnophilia, Rough Sex, Forced Orgasm, Forced, Non-Consensual Oral Sex, Vaginal Sex, Vaginal Fingering, fleshlight, Sex Toys, Creampie, Animated GIFs, PORN gifs, Angst and Porn, Porn Video, Porn Watching, Sexual Coercion, Embedded Images, nsfw gifs, Unprotected Sex",English,2020-06-12,Completed,2020-08-23,5908,4/4,35,630,94,82138
25809469,Miracle on Isle Esme,General Audiences,"F/M, M/M","Twilight Series - Stephenie Meyer, Twilight Series - All Media Types, Twilight (Movies)","Emmett Cullen/Rosalie Hale, Edward Cullen/Bella Swan, Carlisle Cullen/Esme Cullen, Alice Cullen/Jasper Hale, Jacob Black/Renesmee Cullen, Seth Clearwater/OC","Rosalie Hale, Edward Cullen, Emmett Cullen, Alice Cullen, Jasper Hale, Esme Cullen, Carlisle Cullen, Renesmee Cullen, Jacob Black, Seth Clearwater","Magic, Isle Esme, Unplanned Pregnancy, Pregnancy, Volturi, Family Drama, Romance, Cross-Posted on FanFiction.Net, IDK where Twi-hards go to read fics anymore okay, Smut, Explicit Sexual Content, Amazonian Coven - Freeform, Folklore",English,2020-08-09,Updated,2020-08-22,11079,13/?,8,33,4,1000
25950979,Intuitive,Teen And Up Audiences,F/M,Twilight Series - Stephenie Meyer,"Emmett Cullen/Rosalie Hale, Carlisle Cullen/Esme Cullen, Alice Cullen/Jasper Hale","Alice Cullen, Emmett Cullen, Esme Cullen, Rosalie Hale, Jasper Hale, Edward Cullen","Pre-Series, Feral Behavior, Prophetic Visions",English,2020-08-17,Completed,2020-08-22,3431,6/6,54,51,8,600
23504926,Child's Song,Teen And Up Audiences,"F/M, F/F","Twilight Series - Stephenie Meyer, Twilight Series - All Media Types","Former Bella Swan/Edward Cullen, Edward Cullen/Bella Swan, Renesmee Cullen/Other(s), Renesmee Cullen/Nicholas Stone, Evander Cullen/Mackenzie Black","Bella Swan, Edward Cullen, Renesmee Cullen, Cullen Family, Evander Cullen","Character Study, 2nd person POV, New Moon AU, Bella grows up, Line cook, baker - Freeform, Writer, College, she lives a human life, Vampires, Childhood Memories, Childhood Trauma, Edward raises Renesmee, Edward grows up, Renesmee grows up, Renesmee is bisexual, Renesmee runs away, Evander runs away, Evander grows up, music is life, Music, Family, Family Fluff, Family Issues, Dysfunctional Family, The Cullen family is not okay",English,2020-04-06,Completed,2020-08-22,15921,4/4,2,28,6,334
25947475,Her Choice,Teen And Up Audiences,,Twilight Series - Stephenie Meyer,"Sam Uley/Emily Young, Past Leah Clearwater/Sam Uley, Past Edward Cullen/Bella Swan - Relationship, Harry Clearwater/Sue Clearwater","Emily Young (Twilight), Leah Clearwater, Bella Swan, Jacob Black, Seth Clearwater","Imprinting (Twilight), Fluff and Angst, New Moon AU, Twilight Rewrite, Alternate Universe",English,2020-08-17,Updated,2020-08-22,19578,3/?,9,11,7,229
25062784,Dusk,Teen And Up Audiences,F/F,Twilight Series - Stephenie Meyer,"Rosalie Hale/Bella Swan, Alice Cullen/Jasper Hale, Edward Cullen/Emmett Cullen, Carlisle Cullen/Esme Cullen","Charlie Swan, Rosalie Hale, Edward Cullen, Jasper Hale, Emmett Cullen, Esme Cullen, Carlisle Cullen, Jacob Black","Fix-It, Trans Bella Swan",English,2020-07-04,Updated,2020-08-22,97843,15/24,41,55,18,3464
26040430,Legion Gamer: Bella Swan Edition,Mature,F/F,"Twilight Series - Stephenie Meyer, Twilight Series - All Media Types",,Bella Swan,"Fanfiction, Femslash, System, Levels, exp, Vampires, Shifters, Eventual Romance, Perks, skills, stats",English,2020-08-22,Updated,2020-08-22,5059,1/?,null,20,8,137
16241993,bullet proof... i wish i was,Mature,F/M,"Twilight Series - All Media Types, Twilight (Movies), Twilight Series - Stephenie Meyer",Edward Cullen/Bella Swan,"Bella Swan, Edward Cullen, Charlie Swan, Carlisle Cullen, Esme Cullen, Alice Cullen, Rosalie Hale, Emmett Cullen, Jasper Hale, Jacob Black, Billy Black, OFC, OMC","Twilight AU, Alternate Universe - Canon Divergence, Vampires, Vampire Hunters, Grief/Mourning, Family Member Death, Murder, Emotional Hurt/Comfort, (eventually there will be comfort I promise), Post-Traumatic Stress Disorder - PTSD, Violence, Aftermath of Violence, Bullying, Eventual Romance, Slow Burn, (the slowest of burns), Pining, Angst and Hurt/Comfort, Heavy Angst, this is not a happy fic, but things get better, long fic, Bella is a vampire hunter, Other Additional Tags to Be Added",English,2018-10-09,Updated,2020-08-22,53262,9/?,19,61,20,932
14684775,Remembrance,Teen And Up Audiences,F/F,Twilight Series - All Media Types,"Alice Cullen/Bella Swan, Alice Cullen & Bella Swan, Carlisle Cullen/Esme Cullen, Emmett Cullen/Rosalie Hale","Alice Cullen, Bella Swan, Edward Cullen, Carlisle Cullen, Esme Cullen, Rosalie Hale, Jasper Hale, Emmett Cullen, Renee Dwyer","young bella, love throughout time, Lesbian Lovin', Lesbians, Vampire/Human, Bella is a kid and Alice loves her but not in a weird way, Mates",English,2018-05-17,Completed,2020-08-21,24925,15/15,38,560,79,8347
26035999,Eternity,General Audiences,F/M,Twilight Series - All Media Types,Edward Cullen/Bella Swan,,,English,2020-08-22,Completed,2020-08-22,613,1/1,null,9,null,134
26035975,Selfish,General Audiences,F/M,Twilight Series - All Media Types,Edward Cullen/Bella Swan,,,English,2020-08-22,Completed,2020-08-22,387,1/1,null,12,null,146
26035474,I hunt for you with bloody feet,General Audiences,F/M,"Twilight Series - Stephenie Meyer, Twilight Series - All Media Types",Jasper Hale/Bella Swan,"Jasper Hale, Bella Swan","Drabble, jasper does harbor a crush but not mentioned, jasper is a savior, bella is sad, Set in Arizona, twilight - Freeform, new moon",English,2020-08-21,Completed,2020-08-21,330,1/1,4,70,6,863
25914751,Harvest Moon,Explicit,F/M,Twilight Series - Stephenie Meyer,CarlislexMolly,Carlisle Cullen,"Plot What Plot/Porn Without Plot, Vaginal Sex, Nipple Licking, Nipple Torture, Breast Sucking",English,2020-08-15,Completed,2020-08-21,10832,6/6,null,null,1,713
26030254,Que le midi seul hate notre retour,Explicit,F/M,Twilight Series - All Media Types,Edward Cullen/Bella Swan,"Bella Swan, Edward Cullen","Lazy Mornings, Morning Sex, Poetry, Light Angst, Warm, Sleepiness, Beds, Conversations About Vampires, Love, Soft Edward Cullen, Romance, Teasing",English,2020-08-21,Completed,2020-08-21,1267,1/1,null,33,5,615
25112869,and on the fourth day,Mature,Gen,Twilight Series - All Media Types,Bella Swan & Victoria,"Bella Swan, Victoria (Twilight)","Implied/Referenced Character Death, Emotional Manipulation, Unhealthy Relationships, rosalie and bella's relationship is referenced but it she don't show up so..., it's not like i can put it in the rosella tag, Getting to Know Each Other, Death Threats, Victoria is her own warning",English,2020-07-12,Updated,2020-08-21,7190,2/4,75,234,40,2169
26026894,Burning Wrong,General Audiences,"F/M, Gen","Twilight Series - All Media Types, Twilight Series - Stephenie Meyer, Twilight (Movies)","Sam Uley/Emily Young, Past Sam Uley/Leah Clearwater, Leah Clearwater & Sam Uley","Leah Clearwater, Sam Uley, Emily Young (Twilight)","Angst, Character Study, Anger, Werewolves, Full Shift Werewolves, POV Female Character, Non-Linear Narrative, Pack Dynamics, Wolf Pack",English,2020-08-21,Completed,2020-08-21,1246,1/1,null,11,3,99
26020072,How the Heart Behaves,Explicit,F/M,"Twilight Series - Stephenie Meyer, Twilight (Movies), Twilight Series - All Media Types",Carlisle Cullen/Bella Swan,"Bella Swan, Carlisle Cullen, Charlie Swan, Edward Cullen, Jacob Black, Victoria (Twilight), Laurent (Twilight)","Hurt/Comfort, Romance, Unresolved Sexual Tension, Slow Burn, Emotional Infidelity, Daydreamed Adultery, May/December Relationship, Age Difference, Blood, Underage Drinking, Seduction",English,2020-08-21,Updated,2020-08-21,2619,1/?,6,35,8,498
26022016,Twilight drabbles.,Teen And Up Audiences,Multi,"Twilight Series - All Media Types, Twilight Series - Stephenie Meyer, Twilight (Movies)",,"Every body can have a moment!, The ""Vampires who?"" Cullens, The ""We're all powerful bitch"" Volturi, Charlotte ""Kick ass southern belle"" Whitlock, Jasper ""God of war-take no shit soft bastard"" 'Hale' Whitlock, Peter ""I just know shit-Bamf motherfucker"" Whitlock, Angela ""Sup whores?"" Weber, Bella ""Danger and I are long lost siblings Hi"" Swan",Whoever I put.,English,2020-08-21,Completed,2020-08-21,9776,5/5,null,1,null,35
26014891,I'm Only Human,Mature,F/M,"Twilight Series - Stephenie Meyer, Twilight Series - All Media Types, Twilight (Movies)","Jasper Hale/Original Female Character(s), Edward Cullen/Bella Swan, Carlisle Cullen/Esme Cullen, Alice Cullen/Original Character(s), Emmett Cullen/Rosalie Hale","Original Female Character(s), Jasper Hale, Alice Cullen, Original Male Character(s), Original Child Character(s), Edward Cullen, Carlisle Cullen, Aro (Twilight), Caius (Twilight), Marcus (Twilight), Emmett Cullen, Esme Cullen, Rosalie Hale, Bella Swan","Vampires, Werewolves, Volturi, Protectiveness, Eventual Romance, I Will Go Down With This Ship, Vampire Turning, Unplanned Pregnancy, Human/Vampire Relationship, True Mates",English,2020-08-20,Updated,2020-08-21,2129,2/?,null,11,4,206
26021401,Protectiveness,Mature,,"Twilight (Movies), Twilight Series - Stephenie Meyer, Twilight Series - All Media Types",Alice Cullen/Jasper Hale,"Jasper Hale, Alice Cullen","Vampires, Protectiveness, Fluff, Fluff and Angst, Cute, Possessive Jasper Hale",English,2020-08-21,Completed,2020-08-21,372,1/1,null,18,1,483
26016877,beautifully happy & painlessly romantic,Not Rated,"F/M, Multi","Twilight Series - Stephenie Meyer, Twilight Series - All Media Types, Twilight (Movies)","Bella Swan/Jacob Black, Jacob Black/Original Female Character, Bella Swan/Edward Cullen","Renesmee Cullen, Embry Call, Quil Ateara, Leah Clearwater, Jared Cameron, Paul Lahote, Kim (Twilight), Sam Uley, Emily Young","Angst, Hurt/Comfort, Regrets, Nostalgia, reconnection",English,2020-08-20,Completed,2020-08-20,2500,1/1,8,21,4,422
26013604,Credit Card,General Audiences,Gen,Twilight Series - All Media Types,,,Humor,English,2020-08-20,Completed,2020-08-20,844,1/1,null,4,null,45
26012077,Hidden Memories,Explicit,F/M,Twilight Series - Stephenie Meyer,Jacob Black/Bella Swan,"Bella Swan, Jacob Black",,English,2020-08-20,Updated,2020-08-20,2635,1/?,1,5,null,180
26001412,Tale of Years: 1950,Teen And Up Audiences,Gen,Twilight Series - Stephenie Meyer,"Alice Cullen/Jasper Hale, Carlisle Cullen/Esme Cullen, Emmett Cullen/Rosalie Hale",Edward Cullen,"Canon Compliant, Pre-Canon, Historical",English,2020-08-20,Completed,2020-08-20,227285,46/46,8,19,3,790
26009764,Her Lion Man,General Audiences,F/M,"Twilight Series - All Media Types, Twilight Series - Stephenie Meyer, Twilight (Movies)",Alice Cullen/Jasper Hale,"Alice Cullen, Jasper Hale","just cute fluff idk, canon compliant but also... with some tinkering",English,2020-08-20,Completed,2020-08-20,871,1/1,null,25,1,223
1171837,Circumspection,Mature,F/M,"Twilight Series - Stephenie Meyer, Twilight (Movies), Twilight Series - All Media Types","Edward Cullen/Bella Swan, Ben Cheney/Angela Webber, Alice Cullen/Jasper Hale, Emmett Cullen/Rosalie Hale","Jessica Stanley, Lauren Mallory, Jacob Black","Blood, Violence, Mild Gore, Vampires, Biting, venom - Freeform, Manipulation, Kinda Trigger-y, Torture",English,2020-08-20,Completed,2020-08-20,5160,1/1,2,48,14,833
25715566,Family doesn't end with blood,General Audiences,F/M,"Twilight Series - All Media Types, Twilight Series - Stephenie Meyer","Alice Cullen/Jasper Hale, Carlisle Cullen/Esme Cullen, Emmett Cullen/Rosalie Hale","Carlisle Cullen, Edward Cullen, Esme Cullen, Alice Cullen, Jasper Hale, Emmett Cullen, Rosalie Hale, Caius (Twilight), Marcus (Twilight), Aro (Twilight)",,English,2020-08-04,Updated,2020-08-20,2770,4/?,null,4,1,103
26006080,NSFW Alphabet - Jasper Hale,Mature,F/M,Twilight Series - All Media Types,Jasper Hale/You,"Jasper Hale, Reader","NSFW, Smut, Top Jasper Hale",English,2020-08-20,Completed,2020-08-20,1323,1/1,null,21,2,720
26005597,The Angel of Death,Explicit,"F/M, M/M, Multi",Twilight Series - All Media Types,"Carlisle Cullen & Edward Cullen, Carlisle Cullen & Rosalie Hale, Carlisle Cullen & Jasper Hale, Carlisle Cullen & Emmett Cullen, Alice Cullen & Carlisle Cullen, Carlisle Cullen & Charlie Swan","Carlisle Cullen, Edward Cullen, Rosalie Hale, Jasper Hale, Emmett Cullen, Alice Cullen, Charlie Swan","Vampires, Vampire Sex, Character Turned Into Vampire, Vampire Turning, Vampire Bites, Human/Vampire Relationship",English,2020-08-20,Updated,2020-08-20,980,1/?,null,5,null,201
26004745,Stolen Lullabies,Mature,F/M,Twilight,Emmett Cullen/Rosalie Hale,"Emmett Cullen, Rosalie Hale","#WhatIfRosalieWroteFolklore #hurt/comfort #RosalieHale #EmmettMcCarty #FuckRoyce #KindaHateEdward, #ButEdwardIsNiceInThis",English,2020-08-20,Completed,2020-08-20,1245,1/1,null,3,null,82
25930459,New Moon Alternate Ending,Teen And Up Audiences,Gen,"Twilight Series - Stephenie Meyer, Twilight (Movies)",Edward Cullen/Bella Swan,"Bella Swan, Edward Cullen, Alice Cullen, Jasper Hale, Rosalie Hale, Emmett Cullen, Carlisle Cullen, Esme Cullen","Book: New Moon, Canon Rewrite, Alternate Ending, Bella is pissed",English,2020-08-16,Completed,2020-08-20,7914,3/3,4,54,6,835
25999252,Nicknames,General Audiences,F/M,Twilight Series - All Media Types,Edward Cullen/Bella Swan,"Edward Cullen, Bella Swan","Fluff, Love, Vampires",English,2020-08-19,Completed,2020-08-19,331,1/1,null,17,1,354
25999174,Head Above Water,Teen And Up Audiences,"F/F, F/M","Twilight Series - Stephenie Meyer, Twilight Series - All Media Types","Edward Cullen/Bella Swan, Leah Clearwater/Bella Swan","Leah Clearwater, Bella Swan, Edward Cullen, Charlie Swan, Sue Clearwater, Seth Clearwater, Billy Black, Jacob Black, Alice Cullen, Rosalie Hale, Sam Uley, Emily Young (Twilight), Jasper Hale, Emmett Cullen, Carlisle Cullen, Esme Cullen",,English,2020-08-19,Completed,2020-08-19,977,1/1,2,22,null,333
25997917,Twilight one Shots,Mature,"F/F, F/M",Twilight Series - All Media Types,,,,English,2020-08-19,Completed,2020-08-19,3270,1/1,null,null,null,13
14804258,Three's a Crowd,Mature,"F/M, M/M, Other",Twilight (Movies),"Embry Call/Reader, Embry Call x Reader, Paul Lahote/Reader, Paul Lahote x Reaader, Embry Call/Paul Lahote/Reader","Embry Call, Paul Lahote, Reader, You","Polyamory, Romance, Slow Burn, Fluff, Fluff and Smut, Fluff and Angst, Light Angst, Slow To Update",English,2018-05-30,Updated,2020-08-19,15040,13/?,27,189,36,3418
