work_id,title,rating,category,fandom,relationship,character,additional tags,language,published,status,status date,words,chapters,comments,kudos,bookmarks,hits23659141,Chance Encounters,Mature,F/M,Twilight Series - All Media Types,Garrett/Bella Swan,"Garrett (Twilight), Bella Swan, Jasper Hale, Alice Cullen, Emmett Cullen, Rosalie Hale",,English,2020-04-15,Updated,2020-10-13,23980,5/?,5,55,17,807
21311572,From a Sheep to Fox,Not Rated,,Twilight Series - All Media Types,"Caius/Bella Swan, Edward Cullen/Bella Swan","Edward Cullen, Bella Swan, Caius (Twilight), Marcus (Twilight), Aro (Twilight), Alice Cullen, Carlisle Cullen, Esme Cullen, Felix (Twilight)","Book: New Moon, Twilight References",English,2019-11-04,Updated,2020-10-13,47246,19/22,51,234,56,4921
26089681,Unfading Joy and Sorrow,Explicit,"F/M, Multi","Twilight Series - Stephenie Meyer, Twilight Series - All Media Types, Twilight (Movies)","Aro (Twilight)/Caius (Twilight)/Marcus (Twilight)/Original Female Character(s), Aro (Twilight)/Original Female Character(s), Marcus (Twilight)/Original Female Character(s), Caius (Twilight)/Original Female Character(s), Original Female Character/Original Male Character","Aro (Twilight), Caius (Twilight), Marcus (Twilight), Original Female Character(s)","Implied/Referenced Rape/Non-con, Implied/Referenced Self-Harm, Recreational Drug Use, Smoking, Drinking, Mental Health Issues, Blood Kink, Original Character(s), Vampires, plus sized character",English,2020-08-24,Updated,2020-10-13,36607,6/?,21,76,12,1572
25868950,Finding My Place | Jasper Hale,Not Rated,F/M,"Twilight Series - Stephenie Meyer, Twilight Series - All Media Types, Twilight (Movies)","Jasper Hale/Original Character(s), Emmett Cullen/Rosalie Hale, Edward Cullen/Bella Swan","Jasper Hale, Emmett Cullen, Rosalie Hale, Edward Cullen, Bella Swan, Alice Cullen, Original Swan Character(s) (Twilight), Charlie Swan","twilight - Freeform, Fanfiction, OC, Fanfic",English,2020-08-12,Completed,2020-10-13,19279,10/10,null,25,3,1104
26990155,Caramel Latte,General Audiences,F/M,Twilight Series - All Media Types,Alice Cullen/Jasper Hale,"Jasper Hale, Alice Cullen, Rosalie Hale, Bella Swan","Fluff, Alternate Universe - Coffee Shops & Cafes, Love, Marriage, True Love, Fashion Designer Alice, Dresses",English,2020-10-13,Completed,2020-10-13,1136,1/1,null,null,null,64
26943745,Secrets,Teen And Up Audiences,F/M,Twilight Series - Stephenie Meyer,"Edward Cullen/Bella Swan, all usual canon pairings","Edward Cullen, Bella Swan, Jessica Stanley, Lauren Mallory, Mike Newton, Angela Weber, Charlie Swan, Leah Clearwater, Jacob Black, Carlisle Cullen, Esme Cullen, Jasper Hale, Alice Cullen, Rosalie Hale, Emmett Cullen, Laurent (Twilight), Victoria (Twilight), James (Twilight)","Alternate Universe - Character Changes, Bella Jacob and Leah are not who you think they are, Bella's got a secret, Edward's POV, all the female characters have been tweaked, well not Alice because she is perfect, Edward learns to respect boundaries, lots of cute fluff eventually, but first we angst, excuse my dust while I clean up years-old writing, Bella but with a personality, Bella but can take care of herself, Edward is an unreliable narrator",English,2020-10-11,Updated,2020-10-13,11589,4/?,8,17,4,195
24990571,Random Student: Paranoid Investigator,Teen And Up Audiences,Other,"Twilight Series - Stephenie Meyer, Twilight Series - All Media Types",,"Bella Swan, Edward Cullen, Jasper Hale, Rosalie Hale, Tina Garbage (Original Character), Carlisle Cullen, Alice Cullen, Charlie Swan, Emmett Cullen, Jacob Black","Parody, Comedy, Original Character(s), Friendship, Fun, Lots of sarcasm, not meant to hate on twilight fans, Mystery, Paranormal Investigators, POV Original Character, Twilight Parody, Alternate Universe - Canon, Twilight Renaissance",English,2020-06-30,Updated,2020-10-13,19754,12/?,null,8,1,185
26113501,Mates,Teen And Up Audiences,F/F,"Twilight Series - Stephenie Meyer, Twilight Series - All Media Types, Twilight (Movies)","Tanya/Carmen, Tanya Denali/Carmen Denali, Edward Cullen/Bella Swan, Garrett/Kate (Twilight)","Tanya (Twilight), Carmen (Twilight), Kate (Twilight), Bella Swan, Renesmee Cullen, Garrett (Twilight), Eleazar (Twilight), Edward Cullen","I really ship the two of them, They have more chemistry than Edward and Bella in the whole series, Cute lesbians, Fluff, Comfort, Not Canon Compliant",English,2020-08-25,Updated,2020-10-13,2812,2/3,1,8,1,156
14139156,The Queen,Mature,F/M,"Twilight Series - Stephenie Meyer, Twilight (Movies)","Marcus (Twilight)/Original Female Character(s), Caius (Twilight)/Original Female Character(s), Aro (Twilight)/Original Female Character(s)","The Volturi (Twilight), the Cullens, Twilight Series Characters","Polyamory, graphic smut, Violence, trigger warning: blood, Bella Swan Bashing, Character Turned Into Vampire",English,2018-03-29,Updated,2020-10-13,13289,9/?,38,385,85,8253
26984962,The Adventures of Prince Town,General Audiences,F/M,Twilight Series - Stephenie Meyer,Edward Cullen/Bella Swan,"Edward Cullen, Bella Swan, Alice Cullen",,English,2020-10-13,Completed,2020-10-13,2398,1/1,2,2,null,16
25417525,Solstice,Mature,Multi,Twilight Series - Stephenie Meyer,"Alice Cullen/Jasper Hale, Edward Cullen/Bella Swan, Carlisle Cullen/Esme Cullen, Emmett Cullen/Rosalie Hale, Jacob Black/Renesmee Cullen, Mike Newton/Jessica Stanley, Sue Clearwater/Charlie Swan, Billy Black & Original Female Character(s), James/Victoria (Twilight), Carmen/Eleazar (Twilight), Garrett/Kate (Twilight), Alice Cullen & Carlisle Cullen, Carlisle Cullen & Jasper Hale, Carlisle Cullen & Edward Cullen, Carlisle Cullen & Rosalie Hale, Carlisle Cullen & Emmett Cullen, Harry Clearwater/Sue Clearwater, Charlotte/Peter (Twilight)","Alice Cullen, Jasper Hale, Carlisle Cullen, Esme Cullen, Bella Swan, Edward Cullen, Cynthia Brandon, Lauren Mallory, Jessica Stanley, Mike Newton, Original Human Character(s), Jacob Black, Billy Black, Charlie Swan, Sam Uley, Jared Cameron, Embry Call, Paul Lahote, Quil Ateara V, Quil ""Old Quil"" Ateara III, Seth Clearwater, Leah Clearwater, Sue Clearwater, Harry Clearwater, Kim Connweller, Emily Young (Twilight), Bree Tanner, Victoria (Twilight), James (Twilight), Laurent (Twilight), Eric Yorkie, Tyler Crowley, Maria (Twilight), Nettie (Twilight) (Mentioned), Lucy (Twilight) (Mentioned), Peter (Twilight), Charlotte (Twilight), Aro (Twilight) (Mentioned), The Volturi (Twilight), Alistair (Twilight), Angela Weber, Ben Cheney, Garrett (Twilight)","Human Alice Cullen, Philosophical Emmett Cullen, Edward Cullen Being An Asshole, Protective Edward Cullen, Protective Carlisle Cullen, Protective Esme Cullen, BAMF Esme Cullen, BAMF Carlisle Cullen, BAMF Jasper Hale, Possessive Alice Cullen, Larger Supernatural World, Aro is a Paranoid Asshole, Witches, Dhampir, Mermaids, actual werewolves, Thunderbirds - Freeform, Rosalie Hale has Feelings, Protective Rosalie Hale, Protective Emmett Cullen, Snarky Edward Cullen, snarky siblings, Sibling Love, Protective Siblings, Adopted Children, accidental teenager acquisition",English,2020-07-21,Updated,2020-10-12,109578,15/23,1,16,8,684
24971614,Animal Magnetism,Mature,F/M,"Twilight Series - All Media Types, Twilight Series - Stephenie Meyer, Twilight (Movies)",Edward Cullen/Bella Swan,"Edward Cullen, Bella Swan, Renee Dwyer, Charlie Swan, Alice Cullen, Jasper Hale, Emmett Cullen, Rosalie Hale, Carlisle Cullen, Esme Cullen, Jessica Stanley, Angela Weber, Mike Newton, Eric Yorkie, Tyler Crowley, Jacob Black","Love triangles don't live here, Bella has friends in Phoenix, Edward is less of a stalker, Bella Swan with a Backbone, Edward is slightly less of a mopey anxiety boy",English,2020-06-29,Updated,2020-10-12,110261,22/25,131,125,42,3951
26978992,We've Met Before,Mature,F/M,Twilight Series - Stephenie Meyer,Alice Cullen/Jasper Hale,"Alice Cullen, Jasper Hale, Edward Cullen, Carlisle Cullen","Pre-Canon, Pre-Twilight, Other Additional Tags to Be Added, First Meetings",English,2020-10-12,Updated,2020-10-12,873,2/?,null,1,null,32
26978674,Help,Teen And Up Audiences,,Twilight Series - Stephenie Meyer,,,,English,2020-10-12,Completed,2020-10-12,148,1/1,2,null,null,35
26493340,Daybreak,Not Rated,F/M,"Twilight Series - Stephenie Meyer, Twilight Series - All Media Types, Twilight (Movies)","Paul Lahote/Original Female Character(s), Paul Lahote/Original Character(s), Edward Cullen/Bella Swan, Jacob Black/Bella Swan, Alice Cullen/Jasper Hale, Emmett Cullen/Rosalie Hale, Carlisle Cullen/Esme Cullen, Paul Lahote x Original Female Character, Paul Lahote/OC, Wolf Pack (Twilight)/Original female character, Embry Call/Original Female Character(s), Embry Call/(platonic) Original Female Character, Jared Cameron/Kim Connweller, Sam Uley/Emily Young","Original Characters, Original Female Character(s), Original Male Character(s), Bella Swan, Charlie Swan, Paul Lahote, Embry Call, Jared Cameron, Quil Ateara V, Sam Uley, Emily Young (Twilight), Kim Connweller, Leah Clearwater, Sue Clearwater, Billy Black, Carlisle Cullen, Esme Cullen, Rosalie Hale, Alice Cullen, Jasper Hale, Emmett Cullen, Renesmee Cullen, Edward Cullen","Book: New Moon, Twilight References, Imprinting (Twilight), Werewolf Mates, Imprinting, Strong Female Characters, Sisters, Vampires, Original Character(s), Major Original Character(s), Slow Burn, Fluff, Angst, Angst with a Happy Ending, Angst and Hurt/Comfort, Falling In Love, twilight werewolfs, Wolf Pack",English,2020-09-16,Updated,2020-10-12,15484,6/?,24,61,21,795
26977366,Illicit Affairs,Mature,F/M,"Twilight Series - Stephenie Meyer, Twilight Series - All Media Types, Twilight (Movies)",Alice Cullen/Jasper Hale,"Jasper Hale, Alice Cullen",Alternate Universe - Human,English,2020-10-12,Completed,2020-10-12,3190,1/1,13,10,1,116
26974387,New Girl,Teen And Up Audiences,F/F,"Twilight Series - Stephenie Meyer, Twilight Series - All Media Types, Twilight (Movies)","Rosalie Hale/Reader, Edward Cullen/Bella Swan","Rosalie Hale, Reader, Alice Cullen, Emmett Cullen, Carlisle Cullen, Edward Cullen, Jessica Stanley","reader has a motorcycle, she's also Rosalie's mate, Pining, Rosalie denies it, Alice knows",English,2020-10-12,Completed,2020-10-12,2261,1/1,null,26,2,245
25957141,Black Sun,Mature,"M/M, Multi","Twilight Series - Stephenie Meyer, Twilight Series - All Media Types, Twilight (Movies)",Emmett Cullen/Original Male Character(s),"Jacob Black, Jacob Black's Pack (Twilight), Emmett Cullen, Cullen Family, Sam Uley's Pack (Twilight)",,English,2020-08-17,Updated,2020-10-12,3776,4/17,1,2,null,85
26971429,Vampire Series,Teen And Up Audiences,F/M,Twilight Series - Stephenie Meyer,,"Bella Swan, Jasper Hale, Peter (Twilight), Garrett (Twilight), Edward Cullen",,English,2020-10-12,Updated,2020-10-12,9951,8/?,1,3,2,36
24220570,Fortunate Chance,Mature,F/F,Twilight Series - All Media Types,"Alice Cullen/Bella Swan, Minor or Background Relationship(s), Carlisle Cullen/Esme Cullen, Emmett Cullen/Rosalie Hale","Bella Swan, Alice Cullen, Renee Dwyer, Charlie Swan, Eric Yorkie, Angela Weber, Jessica Stanley, Mike Newton, Billy Black, Jacob Black, Minor Characters, Harry Clearwater, Sue Clearwater, Seth Clearwater, Leah Clearwater, Emmett Cullen, Rosalie Hale","Alternate Universe - Canon Divergence, Alternate Timelines, Mental Health Issues, Flashbacks, probably a very, Slow Burn, Fluff, Angst, Drama, Romance",English,2020-05-16,Updated,2020-10-12,83271,16/20,172,262,47,5708
25758502,Dusk,Not Rated,"F/M, M/M",Twilight Series - All Media Types,"Emmett Cullen/Beau Swan, Edythe Cullen/Royal Hale, Alice Cullen/Jasper Hale, Carlisle Cullen/Esme Cullen",,,English,2020-08-07,Updated,2020-10-12,13939,2/?,2,3,null,46
26686894,Cuori in Guerra,Teen And Up Audiences,"F/F, F/M, M/M, Multi, Other","Twilight (Movies), Twilight Series - Stephenie Meyer, Twilight Series - All Media Types","The Volturi (Twilight)/Original Character(s), Edward Cullen/Bella Swan, Alice Cullen/Jasper Hale, Carlisle Cullen/Esme Cullen, Aro (Twilight)/Caius (Twilight)/Marcus (Twilight)/Original Character(s), Aro (Twilight)/Original Character(s), Caius (Twilight)/Original Character(s), Marcus (Twilight)/Original Character(s), Demetri/Felix (Twilight), Emmett Cullen/Rosalie Hale","Aro (Twilight), Marcus (Twilight), Caius (Twilight)","Angst, Eventual Smut, War, Soulmates, True Mates, Vampires, Character Turned Into Vampire, Shapeshifting, Alternate Universe - Rock Band, Royalty, Holidays, Ballroom Dancing, Nonbinary Character, They/ Them Pronouns Main Character, AFAB, Queer Themes, Queer Character, Post-Canon, Polyamory, Polyamorous Character, BDSM, Rope Bondage, Trauma, Blood Kink, Knifeplay, Predator/Prey, Age Difference, Divorce, Choking, Riding Crops, Paint Kink, Break Up, Flashbacks, powers, Daddy Kink, Daddy Issues, Sugar Daddy, Sugar Daddies, Romance, Eventual Romance, Cuddling & Snuggling, Reading, Public Display of Affection, Public Sex, Slow Burn, Slow Build, Slow Romance, The Volturi (Twilight)/Original Character(s) - Freeform, Light Angst, Werewolves, Caius (Twilight) - Freeform, Marcus (Twilight) - Freeform, Aro (Twilight) - Freeform, Emmett Cullen/Rosalie Hale - Freeform, Demetri/Felix (Twilight) - Freeform, Marcus (Twilight)/Original Character(s) - Freeform, Caius (Twilight)/Original Character(s) - Freeform, Aro (Twilight)/Original Character(s) - Freeform, Aro (Twilight)/Caius (Twilight)/Marcus (Twilight)/Original Character(s) - Freeform, Carlisle Cullen/Esme Cullen - Freeform, Alice Cullen/Jasper Hale - Freeform, Edward Cullen/Bella Swan - Freeform, Threesome",English,2020-09-27,Updated,2020-10-12,9686,10/?,null,6,2,197
16581494,Trust No One,Mature,F/M,Twilight Series - Stephenie Meyer,Edward Cullen/Bella Swan,"Edward Cullen, Bella Swan","Romance, Drama",English,2018-11-10,Updated,2020-10-12,40456,15/?,14,83,16,1267
26590957,fast cars and money heists,Explicit,F/M,"Twilight Series - All Media Types, Twilight Series - Stephenie Meyer, Twilight (Movies)",Alice Cullen/Jasper Hale,"Alice Cullen, Jasper Hale, James (Twilight), Carlisle Cullen, Esme Cullen, Edward Cullen, Rosalie Hale, Emmett Cullen, Bella Swan, Jacob Black, Victoria (Twilight), Laurent (Twilight)","alternative universe, In which Alice is not bubbly and loud, She's a badass white collar criminal, and steals from casinos, Jasper is troubled ex soldier FBI guy, not your cute vampire story, no vampires here, Angst and Porn, and some romance too, Cowboy Jasper, bossy Alice",English,2020-09-22,Updated,2020-10-12,6785,2/20,22,8,2,111
25614127,Sic Semper Tyrannis,Mature,Gen,Twilight Series - Stephenie Meyer,"Alice Cullen/Jasper Hale, Afton/Chelsea (Twilight), Carlisle Cullen/Esme Cullen, Emmett Cullen/Rosalie Hale, Aro/Sulpicia (Twilight), Charlotte/Peter (Twilight)","Jasper Hale, Alice Cullen, Peter (Twilight), Charlotte (Twilight), Aro (Twilight), Chelsea (Twilight), Afton (Twilight), Demetri (Twilight), Felix (Twilight), Carlisle Cullen, Esme Cullen, Rosalie Hale, Emmett Cullen","Alternate Universe - Canon Divergence, Historical References, Canon Backstory",English,2020-07-30,Updated,2020-10-11,90251,17/?,6,9,1,190
26686987,Seen by Her Eyes,Mature,F/M,"Twilight Series - Stephenie Meyer, Twilight Series - All Media Types, Twilight (Movies)",Leah Clearwater/Carlisle Cullen,"Leah Clearwater, Carlisle Cullen, Jacob Black, Edward Cullen, Bella Swan, Sam Uley, Embry Call, Rosalie Hale, Emmett Cullen, Alice Cullen, Jasper Hale, Seth Clearwater",Romance,English,2020-09-27,Updated,2020-10-11,6604,3/?,5,11,2,144
26959663,Life and Death: Twilight Genderswapped Guide,Teen And Up Audiences,Gen,"Twilight Series - Stephenie Meyer, Twilight Series - All Media Types",,"Beau Swan, Edythe Cullen, Archie Cullen, Jessamine Hale, Eleanor Cullen, Royal Hale, Carine Cullen, Earnest Cullen, Jules Black, Bonnie Black, Paula Lahote, Samantha Uley, McKayla Newton, Jeremy Stanley, Logan Mallory, Erica Yorkie, Allen Weber, Becca Cheney, Kirill (Life and Death), Ivan (Life and Death), Elena (Twilight)",Genderbending,English,2020-10-11,Completed,2020-10-11,154,1/1,null,2,null,37
16540349,You Have to Kill your Morals to Survive,Teen And Up Audiences,F/F,Twilight Series - All Media Types,Leah Clearwater/Bella Swan,"Bella Swan, Leah Clearwater, Edward Cullen",,English,2018-11-06,Updated,2020-10-11,24767,11/?,25,100,23,2638
26957554,Family Intervention,Not Rated,F/F,Twilight Series - All Media Types,"Esme Cullen/Bella Swan, Rosalie Hale & Bella Swan, Alice Cullen & Bella Swan, Emmett Cullen/Rosalie Hale, Alice Cullen/Jasper Hale, James/Victoria (Twilight)","Bella Swan, Esme Cullen, Alice Cullen, Rosalie Hale, Emmett Cullen, Jasper Hale, Carlisle Cullen, Edward Cullen, Victoria (Twilight), James (Twilight), Laurent (Twilight), Didyme (Twilight)",Edward Cullen Bashing,English,2020-10-11,Completed,2020-10-11,8039,1/1,10,34,6,348
26455141,The Encounter,Teen And Up Audiences,"Other, F/M, M/M, Multi","Twilight Series - Stephenie Meyer, Twilight Series - All Media Types","Edward Cullen/Bella Swan, Alice Cullen/Jasper Hale, Emmett Cullen/Rosalie Hale, Carlisle Cullen/Esme Cullen, Phil Dwyer/Renee Dwyer, Harry Clearwater/Sue Clearwater, James/Laurent/Victoria (Twilight)","Victoria (Twilight), James (Twilight), Laurent (Twilight), Bella Swan, Edward Cullen, Jacob Black, Charlie Swan, Renee Dwyer, Alice Cullen, Esme Cullen, Carlisle Cullen, Rosalie Hale, Jasper Hale, Emmett Cullen, Billy Black, The Volturi (Twilight), Leah Clearwater, Seth Clearwater, Embry Call, Quil Ateara V, Quileute Tribe, Harry Clearwater, Sue Clearwater, Jessica Stanley, Mike Newton, Angela Weber, Eric Yorkie","Twilight Series Rewrite, Twilight Renaissance, Alternate Canon",English,2020-09-14,Updated,2020-10-11,21136,8/21,null,9,4,275
26953261,First Date Double Drabble,General Audiences,F/F,"Twilight Series - Stephenie Meyer, Twilight Series - All Media Types",Rosalie Hale/Bella Swan,"Rosalie Hale, Bella Swan","Fluff, Oneshot, Double Drabble, Coffee, First Date, Autumn",English,2020-10-11,Completed,2020-10-11,213,1/1,null,27,2,361
26952769,October drabble,General Audiences,F/F,"Twilight Series - Stephenie Meyer, Twilight Series - All Media Types",Rosalie Hale/Bella Swan,"Bella Swan, Rosalie Hale","Fluff, Autumn, Oneshot, Drabble, October, Coffee",English,2020-10-11,Completed,2020-10-11,106,1/1,null,17,2,239
26861998,Lonely One,Explicit,F/F,Twilight Series - Stephenie Meyer,Rosalie Hale/Bella Swan,"Bella Swan, Rosalie Hale, Jasper Hale, Alice Cullen","Falling In Love, Fluff and Angst, Pining, Explicit Sexual Content",English,2020-10-06,Updated,2020-10-11,9060,2/4,3,60,11,789
26951692,Seducing Chief Swan,Explicit,F/M,Twilight Series - All Media Types,"Charlie Swan/Original Female Character(s), Charlie Swan/Reader, Charlie Swan & Original Female Character(s), Charlie Swan/You","Charlie Swan, Reader, Original Female Character(s), Bella Swan","reader - Freeform, you - Freeform, Age Difference, Sexual Content, blowjob, slight praise kink, Dirty Talk, Smut, One Shot, Oral Sex, Plot What Plot/Porn Without Plot, Team Charlie",English,2020-10-11,Completed,2020-10-11,2819,1/1,2,17,2,402
26951353,Time For Dying,Mature,"F/M, Gen, M/M, Multi","Twilight Series - Stephenie Meyer, Twilight Series - All Media Types","Aro (Twilight)/Caius (Twilight)/Marcus (Twilight)/Original Female Character(s), Aro/Marcus (Twilight), Caius (Twilight)/Original Female Character(s), Marcus (Twilight)/Original Female Character(s), Aro/Caius (Twilight), Caius/Marcus (Twilight), Aro (Twilight)/Original Female Character(s), Aro/Caius/Marcus (Twilight)",,"Blood Drinking, Blood Kink, True Mates, Mates, Human/Vampire Relationship, Light Dom/sub, Blood Magic, Strong Female Characters, Vampire Sex, Polyamory, Painplay, Dom/sub Undertones, Rough Sex, Possessive Behavior, Protectiveness, The Volturi (Twilight) is Good",English,2020-10-11,Updated,2020-10-11,10393,2/?,1,27,3,325
26950132,Clinically Insane,Mature,F/M,"Twilight Series - Stephenie Meyer, Twilight Series - All Media Types, Twilight (Movies)",Alice Cullen/Jasper Hale,"Alice Cullen, Jasper Hale, Rosalie Hale, Emmett Cullen, Edward Cullen, Bella Swan","Alternate Universe - Human, Please Read the Trigger Warnings, Group Therapy, PTSD",English,2020-10-11,Updated,2020-10-11,5145,1/?,21,8,3,65
26660527,Reunite,General Audiences,F/M,"Twilight Series - All Media Types, Twilight Series - Stephenie Meyer","Alice Cullen/Jasper Hale, Emmett Cullen/Rosalie Hale, Edward Cullen/Bella Swan, Carlisle Cullen/Esme Cullen","Jacob Black, Jasper Hale, Maria (Twilight), Edward Cullen, Sam Uley, Carlisle Cullen, Esme Cullen, Rosalie Hale, Seth Clearwater, Leah Clearwater, Emmett Cullen, Bella Swan, Alice Cullen","AU, Jalice",English,2020-09-26,Updated,2020-10-11,3852,4/?,8,7,1,129
26472718,Setting Sun,Teen And Up Audiences,F/M,"Twilight Series - Stephenie Meyer, Twilight Series - All Media Types","Edward Cullen/Bella Swan, Edward Cullen/Original Female Character(s), Jacob Black/Bella Swan, Carlisle Cullen/Esme Cullen, Emmett Cullen/Rosalie Hale, Alice Cullen/Jasper Hale","Edward Cullen, Bella Swan, Original Female Character(s), Alice Cullen, Carlisle Cullen, Emmett Cullen, Esme Cullen, Cullen Family, Jasper Hale, Rosalie Hale, Jacob Black, Quileute Tribe, Charlie Swan, Renee Dwyer, Mike Newton, Jessica Stanley, Angela Weber","Not really an OFC, It's still Bella, But with a different name, and an actual personality, Twilight Rewrite, Bella Swan with a Backbone, charlie isn't a cop, Twilight Fix it, Cullens with personalities, AU, Angst, Drama, Teenaged love, Teenagers acting like actual teenagers, Vampires, Werewolves, Actual diversity, Characters of color, Enemies to Friends to Lovers, BI SEXUAL JACOB!!",English,2020-09-15,Updated,2020-10-11,12585,2/?,6,21,6,244
24063235,Andromeda,Teen And Up Audiences,F/M,Twilight Series - Stephenie Meyer,Edward Cullen/Bella Swan,"Edward Cullen, Bella Swan",Canon Rewrite,English,2020-05-07,Updated,2020-10-11,47975,9/?,36,71,19,1195
20486648,Storms That Haven't Happened Yet,Explicit,"F/F, M/M","Twilight Series - Stephenie Meyer, Twilight Series - All Media Types","Edward Cullen/Jasper Hale, Alice Cullen/Bella Swan","Edward Cullen, Jasper Hale, Alice Cullen, Bella Swan, Esme Cullen, Carlisle Cullen, Emmett Cullen, Rosalie Hale","Mutual Pining, is almost impossible when people can read my minds but i'm doing my best, Angst with a Happy Ending, a fan fiction about scenery, a time honored tradition we call 'trying to fix twilight', it can't be done and yet, Slow Burn, midnight sun did not Solve My Problems so yet again here we are, no seriously like the slowest burn, too many adjectives, some age appropriate consensual teen sexuality, also vampire """"teens""""",English,2019-09-02,Updated,2020-10-10,60173,27/?,232,462,90,10267
18924745,"Marcus Volturi: ""___"" Would Include...",Mature,F/M,Twilight Series - Stephenie Meyer,"Marcus (Twilight)/Original Female Character(s), Marcus (Twilight)/Original Character(s)","Marcus (Twilight), The Volturi (Twilight), Aro (Twilight), Caius (Twilight), Sulpicia (Twilight)",Soulmates,English,2019-05-22,Updated,2020-10-10,5582,7/?,12,80,12,1250
26940904,Frozen Heart,Mature,M/M,Twilight Series - All Media Types,Carlisle Cullen/Original Male Character(s),"Carlisle Cullen, Jasper Hale, Edward Cullen, Alice Cullen, Rosalie Hale, Esme Cullen, Emmett Cullen, Original Male Character(s), Original Female Character(s)","Closeted Character, Abusive Parents, Norway (Country), Bears",English,2020-10-11,Completed,2020-10-11,608,1/1,null,null,2,57
26486533,Unavoidable part one,Mature,F/M,"Twilight Series - Stephenie Meyer, Twilight (Movies), Twilight Series - All Media Types",Jacob Black/Renesmee Cullen,"Jacob Black, Renesmee Cullen, Edward Cullen, Bella Swan",Ten Years Later,English,2020-09-15,Updated,2020-10-10,36787,21/?,null,4,1,218
26390626,Blown Away,Mature,F/M,Twilight,Edward Cullen/Bella Swan,Twilight (Linked Universe),,English,2020-09-10,Completed,2020-10-10,20266,4/4,1,1,1,86
26937547,uninvited guests,Mature,"F/F, F/M",Twilight Series - All Media Types,"Leah Clearwater/Esme Cullen, Leah Clearwater/Carlisle Cullen, Carlisle Cullen/Esme Cullen, Leah Clearwater/Carlisle Cullen/Esme Cullen","Leah Clearwater, Esme Cullen, Carlisle Cullen, Sam Uley (mentioned)","Threesome - F/F/M, Post-Breaking Dawn, Feelings Realization, sort of enemies to friends to lovers",English,2020-10-10,Completed,2020-10-10,2851,1/1,2,12,null,89
26934112,a portrait of my daughters in gold,General Audiences,Gen,Twilight Series - Stephenie Meyer,,"Renee Dwyer, Bella Swan, Phil Dwyer","Grief/Mourning, Post-Breaking Dawn, Death, But Also Life, Siblings",English,2020-10-10,Completed,2020-10-10,5800,1/1,2,15,2,53
26913721,"I Love You, I Will Kill You",Explicit,F/M,Twilight Series - Stephenie Meyer,Marcus/Bella Swan,"Bella Swan, Marcus (Twilight), Aro (Twilight), Caius (Twilight), Jane (Twilight), Charlie Swan","Original Character(s), Fluff and Smut, Shameless Smut, Blood and Violence, Tenderness",English,2020-10-09,Updated,2020-10-10,45761,11/?,10,9,6,345
26160778,Scars To Your Beautiful,Teen And Up Audiences,F/F,Twilight Series - Stephenie Meyer,"Jacob Black/Edward Cullen, Athenodora/Didyme/Sulpicia/Bella Swan","Bella Swan, Jacob Black, Edward Cullen, Cullen Family, The Volturi (Twilight), Athenodora (Twilight), Sulpicia (Twilight), Didyme (Twilight)","Self-Harm, Foursome - F/F/F/F, vampires can be hurt by silver, James is alive",English,2020-08-28,Updated,2020-10-10,4100,5/?,5,22,10,679
