work_id,title,rating,category,fandom,relationship,character,additional tags,language,published,status,status date,words,chapters,comments,kudos,bookmarks,hits
26938042,february,Mature,F/F,Twilight Series - All Media Types,"Rosalie Hale/Bella Swan, Alice Cullen/Bella Swan","Bella Swan, Rosalie Hale, Alice Cullen, Edward Cullen, Emmett Cullen, Charlie Swan, Jessica Stanley, Angela Weber, Eric Yorkie, Mike Newton, Royce King","Horror, Self-Harm, Character Death, Toxic friendship, mentions of Rose/Emmett, Halloween, literature references, when i say gore i mean it, Human AU, Supernatural Elements, Violence/Gore and Blood, here have a fic with my fucking soul in it for no discernible reason!",English,2020-10-10,Updated,2020-10-27,14222,6/7,20,45,11,646
26959726,Vanished before dawn,General Audiences,F/M,Twilight Series - Stephenie Meyer,,"Bella Swan, Edward Cullen, Alice Cullen","Heavy Angst, i feel like i need to say that eng is not my 1st language, so for any mistakes...im sorry!!!and embarrassed!!, also it's my 1st work..., and i dont know how to use tags :(",English,2020-10-11,Completed,2020-10-27,3337,2/2,null,null,null,9
23828989,The Garage,Teen And Up Audiences,F/M,"Twilight Series - Stephenie Meyer, Life and Death - Stephenie Meyer, Twilight Series - All Media Types, Twilight","Leland ""Lee"" Clearwater/Julie ""Jules"" Black, Lee Clearwater/Julie Black, Leland Clearwater/Julie Black, Lee Clearwater/Jules Black","Lee Clearwater, Jules Black, Julie Black, Leland Clearwater, Jacob Black, Leah Clearwater, Sarah Clearwater, Emma Call, Quil Ateara V, Samantha Uley, Sam Uley, Bonnie Black, Holly Clearwater, Jade Cameron, Paula Lahote, Beau Swan, Elliott Young","Angst and Hurt/Comfort, Angst, Friendship/Love, Drama, Canon Compliant, Post-Canon, Contains SPOILERS if you haven't read Life and Death, SPOILERS SPOILERS, Spoilers, Blackwater",English,2020-04-24,Updated,2020-10-27,58608,23/?,8,34,8,463
26914351,The Cullen Father,Not Rated,F/M,Twilight Series - Stephenie Meyer,"Carlisle Cullen/Esme Cullen, Edward Cullen/Bella Swan","Carlisle Cullen, Edward Cullen, Original Characters, Esme Cullen, Renesmee Cullen, Bella Swan","Families of Choice, Family, Family Feels, London, Vampires, Hurt/Comfort, Forks Washington, Father-Son Relationship",English,2020-10-09,Updated,2020-10-27,8643,4/13,2,2,1,88
26447569,Addicted To You REVISED,Explicit,F/M,Twilight Series - Stephenie Meyer,Edward Cullen/Bella Swan,"Bella Swan, Edward Cullen, Jacob Black, Leah Clearwater, Seth Clearwater, Elizabeth Masen, Edward Masen Sr., Alice Cullen, Emmett Cullen, Jasper Hale, Rosalie Hale, Carlisle Cullen, Esme Cullen, Angela Weber, Ben Cheney, Tyler Crowley, Mike Newton, Aro (Twilight), Marcus (Twilight), Caius (Twilight), Peter (Twilight), Charlotte (Twilight)","Romance, Drama, Hurt/Comfort, Vampires, Werewolves, myths",English,2020-09-13,Updated,2020-10-27,169753,45/49,45,24,8,1315
25710196,A Rose By Any Other Name...,General Audiences,"F/F, M/M, Multi","Twilight Series - Stephenie Meyer, Twilight Series - All Media Types","Rosalie Hale/Bella Swan, Rosalie Hale & Bella Swan, Edward Cullen/Emmett Cullen, Alice Cullen/Jasper Hale, Carlisle Cullen/Esme Cullen, Billy Black/Charlie Swan","Bella Swan, Rosalie Hale, Edward Cullen, Emmett Cullen, Alice Cullen, Jasper Hale, Carlisle Cullen, Esme Cullen, Charlie Swan, Jacob Black","Twilight Spitefic, Twilight Renaissance",English,2020-08-04,Updated,2020-10-27,56409,13/28,107,399,67,8014
17293451,Second Chances,Teen And Up Audiences,F/M,Twilight Series - All Media Types,Jacob Black/Original Female Character(s),"Jacob Black, Original Female Character(s), Bella Swan, Sam Uley, Embry Call, Quil Ateara V, Seth Clearwater, Leah Clearwater","Emotional Hurt/Comfort, Self-Discovery, Eventual Relationships, Family Drama, Family Feels, Implied/Referenced Character Death, Childhood Trauma, Wolf Pack, Post-Break Up, Soft Jacob Black, Wolf Pack Drama, Werewolf Drama, Vampire Turning, Volturi, Yes we're touching on Jacob's issues cause the boy's got a lot",English,2020-10-25,Updated,2020-10-27,55705,18/30,26,118,24,2368
27228850,The Night We Met | Volturi Kings,Mature,F/M,Twilight Series - All Media Types,Aro (Twilight)/Caius (Twilight)/Marcus (Twilight)/Original Female Character(s),"Aro (Twilight), Marcus (Twilight), Caius (Twilight), Original Female Character(s), Carlisle Cullen, Esme Cullen, Edward Cullen, Bella Swan, Renesmee Cullen, Rosalie Hale, Emmett Cullen, Jasper Hale, Alice Cullen, Jacob Black, Leah Clearwater, Seth Clearwater, Jane (Twilight), Alec (Twilight), Demetri (Twilight), Felix (Twilight), Heidi (Twilight), Corin (Twilight), Renata (Twilight), Chelsea (Twilight), Santiago (Twilight), Afton (Twilight), Vladimir (Twilight), Stefan (Twilight)","Post-Traumatic Stress Disorder - PTSD, Anxiety Disorder, Depression, Suicidal Thoughts, Drug Abuse, Possessive Behavior, Borderline Yandere, Virgin Volturi Kings",English,2020-10-27,Updated,2020-10-27,4327,3/?,null,null,null,25
25171981,Ourselves | Edward Cullen,Mature,F/M,Twilight Series - Stephenie Meyer,"Edward Cullen/Original Female Character(s), Edward Cullen/Ainsel Graves","Edward Cullen, Carlisle Cullen, Esme Cullen, Rosalie Hale, Emmett Cullen, Jasper Hale, Alice Cullen, Bella Swan, Jacob Black, Jessica Stanley, Angela Webber, Eric Yorkie, Mike Newton, Lauren Mallory, Laurent, James, Victoria, Charlie Swan, The Pack - Character, Billy Black, Harry Clearwater, Sue Clearwater","Reincarnation, Soulmates, Witches, Vampires, Mermaids, Elves, Fairies, Werewolves, Shifters, Angels, Demons, Spirits, mother - Freeform, Awkward Edward, one sided pining, Slow Burn Romance, virgins, dying young, life's purpose, redhead Edward, Ainsel - Freeform",English,2020-10-27,Updated,2020-10-27,4846,3/?,1,9,3,151
23705527,Rosalie Hale's Little Sister,Teen And Up Audiences,Multi,"Twilight Series - Stephenie Meyer, Twilight Series - All Media Types, Twilight (Movies)","Jacob Black/Bella Swan, Edward Cullen/Bella Swan, Seth Clearwater/Original Female Character(s), Seth Clearwater/Original Character(s), Alice Cullen/Jasper Hale, Carlisle Cullen/Esme Cullen, Jacob Black/Renesmee Cullen, Emmett Cullen/Rosalie Hale, Embry Call/Original Female Character(s), Embry Call/Original Character(s)","Bella Swan, Edward Cullen, The Volturi (Twilight), Jane (Twilight), Alec (Twilight), Aro (Twilight), Original Cullen Character(s), Original Female Character(s), Original Male Character(s), Esme Cullen, Renesmee Cullen, Jacob Black, Seth Clearwater, Leah Clearwater, Rosalie Hale, Carlisle Cullen, Jasper Hale, Alice Cullen","Vampires, Vampire Turning, Vampire Bites, Character Turned Into Vampire, Human/Vampire Relationship, Half-Vampires, Witches, Witchcraft, Witch Curses, Wolf Pack, Teenagers, Teen Romance, Teen Angst, Teenage Drama, Horny Teenagers, Teen Crush, Teenage Rebellion, Teen Years, Childhood Friends, Children, Childhood, Childhood Trauma, Childhood Memories, Father-Son Relationship, Father-Daughter Relationship, Fatherhood, Father Figures, Mother-Son Relationship, Mother-Daughter Relationship, Motherhood, Brother-Sister Relationships, Sisters, Sister-Sister Relationship, Little Sisters, Big Sisters, Brothers, Protective Older Brothers, Male-Female Friendship, POV Female Character, Female Friendship, Female Protagonist, Original Female Character(s) - Freeform, Loss of Virginity, Blood Loss, Family Loss, Puberty, Vampire Family, Loss of Parent(s)",English,2020-04-17,Updated,2020-10-27,63538,66/112,2,35,null,1807
27045445,Rosalie's Body,Mature,F/F,Twilight Series - All Media Types,Rosalie Hale/Bella Swan,"Bella Swan, Rosalie Hale, Emmett Cullen, Edward Cullen, Charlie Swan, Renee Dwyer, Alice Cullen","Romance, Monsters, High School, Movie AU, Vampires, something a little spooky for the season, Happy Ending?, sandbox love, Foreshadowing, Drama, Horror kinda, Gay ending",English,2020-10-16,Updated,2020-10-28,14901,4/?,23,47,8,547
27228103,Where Did Everybody Go?,Teen And Up Audiences,F/M,"Twilight Series - Stephenie Meyer, Twilight Series - All Media Types, Twilight (Movies)",Alice Cullen/Jasper Hale,"Alice Cullen, Jasper Hale","Whumptober 2020, Whump, Whumptober, i thought this would hurt more, its sad but it's chill, Just little snipped of an idea I had a while ago",English,2020-10-27,Completed,2020-10-27,699,1/1,null,null,null,18
26410984,supernova,Teen And Up Audiences,F/F,"Twilight Series - Stephenie Meyer, Twilight Series - All Media Types",Edythe Cullen/Bella Swan,"Edythe Cullen, Bella Swan, Carlisle Cullen, Esme Cullen, Alice Cullen, Emmett Cullen, Jasper Hale, Rosalie Hale, Charlie Swan","POV Lesbian Character, Useless Lesbian Vampire, Vampires, Found Family, Rewrite, Fix-It, Those are generous terms for the first couple chapters, maybe the whole thing i haven't finished this yet",English,2020-09-11,Updated,2020-10-27,48390,9/?,8,11,6,419
25688917,I've Been Missing You,Explicit,F/M,Twilight Series - Stephenie Meyer,"Jacob Black/Renesmee Cullen, Jasper Hale/Bella Swan, Alice Cullen/Seth Clearwater, Edward Cullen/Leah Clearwater, Edward Cullen/Maggie","Bella Swan, Edward Cullen, Renesmee Cullen, Jacob Black, Billy Black, Carlisle Cullen, Alice Cullen, Seth Clearwater, Rosalie Hale, Emmett Cullen, Maggie (Twilight), Leah Clearwater, Jasper Hale, Esme Cullen","Slow Burn, Slow Build, Imprinting, Sequel, Explicit Sexual Content, Alternate Universe - Canon Divergence, Breaking Dawn Rewrite",English,2020-08-03,Updated,2020-10-27,181123,18/21,46,59,17,1953
27133244,Siren's Call,Mature,F/M,Twilight Series - Stephenie Meyer,Embry Call/Original Female Character(s),"Embry Call, Quil Ateara IV, Quil ""Old Quil"" Ateara III, Jacob Black, Original Characters, Seth Clearwater, Sam Uley","Romance, Drama",English,2020-10-21,Updated,2020-10-27,12688,4/?,null,6,3,55
26911627,OVERCAST (updates every tue and fri),Mature,"F/F, F/M, Gen, Multi","Twilight Series - Stephenie Meyer, Twilight Series - All Media Types, Twilight (Movies)",,,"Fanfiction, Inspired by the Twilight Series, Original Character(s), Twilight References, Twilight Spitefic, Alternate Universe - Twilight Fusion, Love/Hate, Love, Falling In Love, Love Confessions, Unrequited Love, Idiots in Love, Friendship/Love, Love at First Sight, Forbidden Love, Vampires, Alternate Universe - Vampire, Human/Vampire Relationship, College, University, My First Fanfic, School, Fantasy, Dark Fantasy, Dark, Sexual Fantasy, Romance, Eventual Romance, Drama & Romance, Slow Romance, Awkward Romance, Action & Romance, Angst and Romance, Romantic Comedy, Unresolved Romantic Tension, Romantic Gestures, Romantic Angst, Romanticism, Original Mythology, Original Universe, Original Fiction, Work In Progress, Scottish Character, Scotland, Edinburgh, Cultural Differences",English,2020-10-09,Updated,2020-10-27,19556,14/?,null,null,1,38
27224080,Memories of Venus,General Audiences,F/M,"Twilight Series - Stephenie Meyer, Twilight (Movies)","Edward Cullen/Rosalie Hale, Edward Cullen/Bella Swan","Edward Cullen, Rosalie Hale, Bella Swan","Character Study, Past Memories",English,2020-10-27,Completed,2020-10-27,1585,1/1,null,3,null,16
27221812,Ohio,Mature,F/F,"Twilight Series - All Media Types, Twilight Series - Stephenie Meyer, Twilight (Movies)","Rosalie Hale/Bella Swan, Bella Swan/Victoria","Leah Clearwater, Sam Uley, Bella Swan, Charlie Swan, Paul Lahote, Rosalie Hale","One Shot, AU-No Vampires, Alternate Universe - Normal High School, Unhealthy Relationships, Songfic, Past Infidelity",English,2020-10-27,Completed,2020-10-27,5164,1/1,1,19,null,140
26986657,Dark Paradise,Mature,F/M,Twilight Series - All Media Types,Alice Cullen/Jasper Hale,"Alice Cullen, Jasper Hale, Cynthia Brandon, Lilian Brandon, Edgar Brandon, Anna-Marie Brandon, Edward Cullen, Emmett Cullen","Human/Vampire AU, Alternate Universe - 1920s, Alice is not a vampire -- yet, Jasper on the other hand",English,2020-10-13,Updated,2020-10-27,7485,2/5,17,13,3,111
27222175,Kisses Can't Sustain You,Teen And Up Audiences,F/M,Twilight Series - Stephenie Meyer,"Leah Clearwater/Edward Cullen, Jacob Black/Bella Swan, Edward Cullen/Bella Swan, Emmett Cullen/Rosalie Hale","Edward Cullen, Leah Clearwater, Jacob Black, Bella Swan, Rosalie Hale, Emmett Cullen","Slow Romance, Friends to Lovers, Friendship, Enemies to Friends to Lovers, Werewolves, Worldbuilding, Vampires, Half-Vampires, Christian Character of Color, Angst and Hurt/Comfort, Emotional/Psychological Abuse, Emotional Manipulation, Substance Abuse, Slow Burn, Unrequited Love, Implied/Referenced Suicide",English,2020-10-27,Updated,2020-10-27,2021,1/?,null,null,null,16
27158216,Sweet Home Texas,Teen And Up Audiences,F/M,"Twilight Series - Stephenie Meyer, Twilight Series - All Media Types, Twilight (Movies)","Alice Cullen/Jasper Hale, Emmett Cullen/Rosalie Hale, Charlotte/Peter (Twilight)","Alice Cullen, Jasper Hale, Emmett Cullen, Rosalie Hale, Charlotte (Twilight), Peter (Twilight), Maria (Twilight), Riley Biers","alluded to abuse, Jasper gets called an idiot A LOT, Country girl Alice is thirsty AF, Jasper leans a lot because cowboys don't know how to stand up straight, yes I am STILL on the Riley thing",English,2020-10-23,Updated,2020-10-27,11177,6/10,2,2,null,40
20060578,Shadow of the Moon: A Sun Never Sets sequel,General Audiences,Gen,"Twilight Series - Stephenie Meyer, Twilight Series - All Media Types, Twilight (Movies)",,"Carlisle Cullen, Esme Cullen, Bella Swan, Edward Cullen, Jasper Hale, Rosalie Hale, Alice Cullen, Emmett Cullen, Original Cullen Character(s), Original Male Character(s), Jacob Black, Charlie Swan, Victoria (Twilight), Riley Biers, Bree Tanner, Mike Newton, Jessica Stanley, Angela Weber, Ben Cheney, The Wolfpack, Seth Clearwater, Emily Young (Twilight), Jane (Twilight), Alec (Twilight), Leah Clearwater, Sam Uley, Paul Lahote, Quil Ateara V, Quileute Tribe, Felix (Twilight), Demetri (Twilight), Eleazar (Twilight), Carmen (Twilight), Tanya (Twilight), Kate (Twilight), Irina (Twilight), The Volturi (Twilight)","Twilight References, Alternate Universe, High School, Teenagers, Teen Romance, Original Character(s), Original Character-centric, Minor Original Character(s), Vampires, Vampire Family, Human/Vampire Relationship, Friendship, Seattle, Forks Washington, Forks High School (Twilight), Family, Family Feels, Family Drama, Growing Up, POV Original Character, Immortality, Little Brothers, Brothers, Brotherly Love, Brother-Sister Relationships, Volturi, Canon Continuation",English,2019-08-01,Updated,2020-10-26,113084,27/30,19,53,8,2062
25968547,Would It Be Enough,Explicit,F/M,Twilight Series - All Media Types,,"Carlisle Cullen, Esme Cullen, Renesmee Cullen, Jacob Black, Edward Cullen, Bella Swan, Emmett Cullen, Rosalie Hale, Jasper Hale, Garrett (Twilight), Leah Clearwater, Seth Clearwater, Kate (Twilight), Eleazar (Twilight), Carmen (Twilight), Tanya (Twilight), Jane (Twilight), Alec (Twilight), Demetri (Twilight), Original Volturi Character(s), The Volturi (Twilight)","Original Character(s), POV Original Character, Canon Compliant, Post-Canon, Cross-Posted on FanFiction.Net, Love, Vampire Sex, eventual lemony content, Eventual Smut",English,2020-08-18,Updated,2020-10-26,73067,31/?,9,23,2,603
27187159,Immortal Beloved,Teen And Up Audiences,F/M,"Twilight Series - Stephenie Meyer, Twilight (Movies)",Edward Cullen/Bella Swan,"Edward Cullen, Bella Swan, Jacob Black, OC - Character","Role Reversal, Human Edward Cullen, Vampire Bella Swan",English,2020-10-25,Updated,2020-10-27,12287,5/25,null,2,1,44
26490472,Star-Crossed,Mature,,"Twilight Series - Stephenie Meyer, Twilight (Movies), Twilight Series - All Media Types, Twilight","Edward Cullen/Bella Swan, Paul Lahote/Bella Swan","Edward Cullen, Bella Swan, Jacob Black, Leah Clearwater, Seth Clearwater, Paul Lahote, Billy Black, Sam Uley, Emily Young (Twilight), Jessica Stanley, Angela Weber, Mike Newton, Eric Yorkie","thegardenstate, Imprinting (Twilight), Non-Human Bella Swan, Out of Character Bella Swan",English,2020-09-16,Updated,2020-10-26,18476,6/?,8,31,6,459
25477813,Sunrays on the Horizon,Mature,F/M,"Twilight Series - Stephenie Meyer, Twilight Series - All Media Types",Jacob Black/Leah Clearwater,"Jacob Black, Leah Clearwater, Jacob Black's Pack (Twilight), Seth Clearwater, Billy Black, Sue Clearwater, Sam Uley, Quil Ateara V, Embry Call","Blackwater, Alternate Universe - Canon Divergence, Slow Burn, this is an interpersonal conflict fic, minimal violence, very human focused, I mean as much as you can be with werewolves and vampires, POV Alternating",English,2020-07-24,Updated,2020-10-26,63414,11/?,26,59,13,974
26758294,Back alleys,Mature,,"Twilight Series - Stephenie Meyer, Twilight Series - All Media Types, Twilight (Movies)",,"Bella Swan, Jasper Hale","Angst, implied prostitution, Implied/Referenced Character Death",English,2020-10-01,Updated,2020-10-26,12737,5/?,9,16,5,198
27216526,What If?,Not Rated,"F/M, M/M",Twilight Series - All Media Types,"Seth Clearwater/Jasper Hale, Alice Cullen/Jasper Hale, Edward Cullen/Bella Swan, Emmett Cullen/Rosalie Hale, Carlisle Cullen/Esme Cullen, Jacob Black/Renesmee Cullen","Seth Clearwater, Jasper Hale, Alice Cullen, Edward Cullen, Bella Swan, Emmett Cullen, Rosalie Hale, Carlisle Cullen, Esme Cullen, Original Female Character(s), Leah Clearwater, Jacob Black, Renesmee Cullen",,English,2020-10-26,Completed,2020-10-26,424,1/1,null,2,null,14
26717155,Sing me to Sleep,Not Rated,F/F,Twilight Series - Stephenie Meyer,Rosalie Hale/Bella Swan,Twilight Series Characters,"Implied/Referenced Suicide, Philosophical conversation about superheroes, Alternate Universe, different bella, no beta we die like men!, mate bond, Humorous despite dark themes, where are you going with this?, Supernatural Elements",English,2020-09-29,Updated,2020-10-26,47257,9/?,140,338,65,5464
26399815,POPism,Mature,"F/M, Multi",Twilight Series - Stephenie Meyer,Edward Cullen/Bella Swan,"Bella Swan, Edward Cullen, Jasper Hale, Alice Cullen, Rosalie Hale, Emmett Cullen","Alternate Universe - Historical, 1960s, 1960s Music, Romance, Coming of Age, New York City",English,2020-09-11,Updated,2020-10-26,72758,12/15,9,3,3,144
27112588,Overprotective Fool,Teen And Up Audiences,F/M,"Twilight Series - Stephenie Meyer, Twilight Series - All Media Types, Twilight (Movies)","Alice Cullen/Jasper Hale, Carlisle Cullen/Esme Cullen, Emmett Cullen/Rosalie Hale, Edward Cullen/Bella Swan","Alice Cullen, Jasper Hale, Edward Cullen, Carlisle Cullen, Esme Cullen, Rosalie Hale, Emmett Cullen, Bella Swan","JaliceWeek20, Jaliceweek, Gap Filler, Twilight Renaissance, Book: Eclipse, Canon Compliant, Twilight Gap, Overprotective",English,2020-10-20,Updated,2020-10-26,5751,2/3,7,19,1,146
27214273,"Berry Cobbler, Every Thursday",Explicit,F/M,"Twilight Series - All Media Types, Twilight Series - Stephenie Meyer, Twilight (Movies)","Charlie Swan/Original Female Character(s), Charlie Swan/Reader, Charlie Swan/You","Charlie Swan, Reader, You, Original Female Character(s), Reader - Freeform - Character","Team Charlie, Age Difference, Dirty Talk, Oral Sex, Porn With Plot, Explicit Sexual Content, Older Man/Younger Woman, Semi-Public Sex, Office Sex",English,2020-10-26,Updated,2020-10-26,3404,1/2,2,2,null,89
24241990,One Step at a Time,Not Rated,"F/M, Multi","Twilight Series - Stephenie Meyer, Twilight Series - All Media Types","Aro (Twilight)/Original Female Character(s), Aro (Twilight)/Caius (Twilight)/Marcus (Twilight)/Original Female Character(s), Caius (Twilight)/Original Female Character(s), Marcus (Twilight)/Original Female Character(s)","Aro (Twilight), Caius (Twilight), Marcus (Twilight), Original Swan Character(s) (Twilight), Bella Swan, Original Female Character(s), Original Male Character(s), Original Female Human Character(s), Charlie Swan, Jasper Hale, the Cullens, The Volturi (Twilight), Volturi - Character, Original Volturi Character(s)","Slow Burn, Polyamory, Romance, Canon-Typical Violence, Original Character(s), Soulmates, Twilight Renaissance, Post-Traumatic Stress Disorder - PTSD",English,2020-06-02,Updated,2020-10-26,130993,37/?,213,586,141,14702
25131574,Turning Page,Teen And Up Audiences,F/M,"Twilight (Movies), Twilight Series - All Media Types",Aro/Bella Swan,"Bella Swan, Aro (Twilight), Edward Cullen, Alice Cullen, Jane (Twilight), Alec (Twilight), Marcus (Twilight), Caius (Twilight), Jacob Black, Victoria (Twilight), Riley Biers, Jasper Hale, Esme Cullen, Carlisle Cullen, Charlie Swan, Rosalie Hale, Emmett Cullen, Demetri (Twilight), Felix (Twilight), Heidi (Twilight), Bree Tanner","Alternate Universe, New Moon alternate, Romance, Soulmates, a more mature bella swan, Bella Swan with a Backbone, not a super edward friendly fic, but there's no bashing, events of eclipse loosely followed, absolutely no breaking dawn, a sort of slow burn, normal amounts of vampire gore",English,2020-07-07,Updated,2020-10-26,183950,32/?,385,477,105,11513
26336074,love me at my worst,Mature,F/M,"Twilight Series - Stephenie Meyer, Twilight Series - All Media Types",Jasper Hale/Bella Swan,"Jasper Hale, Bella Swan, Carlisle Cullen, Esme Cullen, Edward Cullen","Post-New Moon, Past Edward Cullen/Bella Swan, BAMF Bella Swan, i lost a competition and this is my punishment, Past Alice Cullen/ Jasper Hale, there shouldn't be angst in this, the friend i'm writing this for doesn't like angst. we'll see.",English,2020-09-07,Updated,2020-10-26,5897,2/?,15,53,13,531
27200665,The AsterAsh Project,Mature,Gen,Twilight Series - Stephenie Meyer,,"Claire Young (Twilight), Leah Clearwater, Seth Clearwater, Jacob Black, Renesmee Cullen, Sam Uley","Blood and Violence, Domestic Violence, Character Death, Action/Adventure, Americana, Native American Character(s), Native American/First Nations History, Angst, Psychological Trauma, Aged-Up Character(s), Trans Male Character, Politics, Police Brutality, Survival Horror, Explicit Language",English,2020-10-26,Updated,2020-10-26,5411,1/?,1,3,null,16
24963856,In the Afterlight,Mature,F/M,"Twilight, Twilight Series - Stephenie Meyer, Twilight Series - All Media Types, Twilight (Movies)",Edward Cullen/Bella Swan,"Edward Cullen, Bella Swan, Charlie Swan, Jacob Black, Alice Cullen, Rosalie Hale, Emmett Cullen, Billy Black, Carlisle Cullen, Esme Cullen","Twilight Renaissance, Alternate Universe - Canon Divergence, Canon Rewrite, Canon Backstory, Sexual Tension, Bella Swan with a Backbone, BAMF Bella Swan, Romance, Slow Burn, Older Man/Younger Woman, Soulmates",English,2020-06-28,Updated,2020-10-26,99507,22/25,194,247,68,5907
25537831,Eventide,General Audiences,F/M,Twilight Series - Stephenie Meyer,Edward Cullen/Bella Swan,"Bella Swan, Edward Cullen, Alice Cullen, Jasper Hale, Rosalie Hale, Emmett Cullen, Carlisle Cullen, Esme Cullen, Jacob Black, Angela Weber, Jessica Stanley",Twilight Series Rewrite,English,2020-07-26,Updated,2020-10-26,97949,28/40,21,35,10,1121
27231568,Fighter: A Twilight Saga Fanfiction,Mature,Multi,"Twilight Series - Stephenie Meyer, Twilight Series - All Media Types","Edward Cullen/Original Female Character(s), Emmett Cullen/Rosalie Hale, Carlisle Cullen/Esme Cullen, Alice Cullen/Jasper Hale","Edward Cullen, Emmett Cullen, Rosalie Hale, Carlisle Cullen, Esme Cullen, Alice Cullen, Jasper Hale, Bella Swan, Original Female Character(s)","Human/Vampire Relationship, Implied/Referenced Abuse, Canon-Typical Violence, Alternate Universe - Canon Divergence, No Renesmee Cullen, Strong Female Main Character",English,2020-10-26,Updated,2020-10-26,907,6/?,null,1,null,2
24437974,"Bathtubs, Bickering and Brandy!",Mature,M/M,"Twilight Series - All Media Types, Twilight Series - Stephenie Meyer",Aro/Garrett (Twilight),"Garrett (Twilight), Aro (Twilight), Carlisle Cullen","merman au, Merman Garrett, Injured Character, Hurt/Comfort, Bickering, Trans Aro, Trans Male Character, Shameless Smut",English,2020-05-29,Updated,2020-10-26,30237,11/?,39,20,4,275
26198413,Ruby Eyes,Mature,F/M,"Twilight Series - Stephenie Meyer, Twilight Series - All Media Types, Twilight (Movies)","Paul Lahote/Original Female Character(s), Paul Lahote/Original Character(s), Paul Lahote/You, Original Male Character(s)/You","Paul Lahote, Original Characters, Edward Cullen, Bella Swan, Carlisle Cullen, Esme Cullen, Alice Cullen, Jasper Hale, Rosalie Hale, Emmett Cullen, Reader, Renesmee Cullen, Charlie Swan, Jacob Black, Billy Black, Sam Uley, Emily Young (Twilight), Jared Cameron, Kim Connweller, Quil Ateara V, Embry Call, Seth Clearwater, Leah Clearwater, Brady Fuller, Collin Littlesea, Sue Clearwater, Claire Young (Twilight)","Reader-Insert, Canon Compliant, Slow Build, Slow Burn, Eventual Romance, Eventual Smut, Manipulation, Emotional/Psychological Abuse, Forced Marriage, Arranged Marriage, Violence, Implied/Referenced Self-Harm, maternal death",English,2020-08-30,Updated,2020-10-26,34234,16/?,16,35,8,712
25855381,The Myth,Not Rated,"F/F, F/M","Twilight Series - Stephenie Meyer, Twilight (Movies), Twilight Series - All Media Types","Emmett Cullen/Rosalie Hale, Alice Cullen/Jasper Hale, Edward Cullen/Bella Swan, Carlisle Cullen/Esme Cullen, OC/OC, Original Female Character/Original Female Character, Jacob Black/Bella Swan","Edward Cullen, Jasper Hale, Emmett Cullen, Carlisle Cullen, Esme Cullen, Rosalie Hale, Alice Cullen, OC (female), Charlie Swan, Jacob Black, Sam Uley, Leah Clearwater, Seth Clearwater, Billy Black, La Push Pack, Victoria (Twilight), James (Twilight), Laurent (Twilight), Aro (Twilight), Caius (Twilight), Marcus (Twilight), The Volturi (Twilight), Jessica Stanley, Angela Weber, Mike Newton, Eric Yorkie, Denali Coven (Twilight), Original Cullen Character(s), Cullens, Other additional characters",,English,2020-08-12,Updated,2020-10-25,5992,3/?,null,8,2,108
